ngram_range,min_df,cv_folds,true_label,pred_label,text
"(1, 1)",6,10,0,1,"We stay at the Palmer House when we attend conferences in Chicago. It is a stately building. But this year, there were ... problems we have not had before. First, they now have wi-fi available, but it is not free. The cost is $7.50 per hour. On-line it indicated that Hilton hotels charge about $4, but this was almost double. Many hotels have free wi-fi. Wi-fi is wi-fi, so the level of service is not a factor that could justify this exorbitant cost. They also charge for their fitness center, even when you are only going to use the machines. There is no business center in-house for copies, etc. Our bed was against a wall that separated us from the bathroom in the next room. It did not separate us from the bathroom noises. When someone took a shower (at 5:30 a.m.), the pipes ""sung"" like old pipes do,but very loudly. An empty wine glass sat outside someone's room door for days without being picked up by housekeeping. The concierge desk had only one person and there was always a line. If you called down, you were put on hold while they dealt with the people in the line. The staff were all very nice, and the location can't be beat, but the luxury prices for normal services felt like a ripoff this year. I doubt we'll return...."
"(1, 1)",6,10,0,1,"Stayed here in November 2011 on a leisure trip to Chicago. Hotel is very dated, with some rooms that just aren't good enough. Front desk staff was rude. Will not be staying here again - prefer the Swissotel and the Hyatt properties (Regency is similarly priced, and Park Hyatt is 3x more) and a list of boutique hotels in the area as well (Kimpton, etc). Pros: -The only hotel that opens onto Michigan Avenue, very close to all of the excitement -Eno Wine Bar has a great selection of cheeses -Rooms are clean Cons: -Some hotel rooms just make no sense - our first room was tiny and had a window overlooking a ledge (effectively no view), and our second room had two windows that looked out onto a brick wall (actually no view) -You have to pay for everything - internet, gym, and the pool (which was not available due to renovation...) -Entire hotel was very old, not in a classical sense but in a ghost story one -Front desk staff was rude"
"(1, 1)",6,10,0,1,"First of all, Expedia.com charged me for an additional person per my instructions but when I arrived at the Hotel these monies were not included and the complimentary breakfast was not offered. The Hotel service person who checked us in forgot to give me back my parking ticket but left a generic message for me stating that there was an envelope at the front desk. I had to wait in line for another 20 minutes to discover this the whole time this person was looking at me and never said a word!! I was charged and paid for parking adjacent to the Hotel. When we went to leave the gate would not open. We had to find the parking garage office and the Manager had to call several times over to the Hotel until finally someone picked up. They confirmed my payment and then we were allowed to leave the structure. The Hotel itself is beautiful!!! The bell hops and doormen were just wonderful. They were more than helpful and gracious but the internal staff were rude and not helpful at all!!!!"
"(1, 1)",6,10,0,1,"We stayed at Amalfi for 2 nights and i have to say after reading all the reviews here i expected a little bit more. It's a fine place with clean bathrooms and comfy beds but it's just not worth the money. It does have comfy beds and free continental breakfast. The sheets though, made us itch for some reason and we are normally not sensitive to these things. The breakfast could really benefit from some bagels or yougurt. Otherwise, it's just an early morning sugar attach of muffins, danishes, sweet breads, and croissants. There are plenty of restaurants around but they are all of the big chain variety, if you are into that sort of thing. Also, the windows do not open and there is a climate control device in the room. The problem with it that it keeps blowing air all the time, alternating between cold and warm, right over the bed. There is a sign not to turn it off but we did once just to see what happens and the air in the room got uncomfortably stale. They do have a business center where you can send fax and use internet for free. The problem is it is only one tiny room with one computer in there. One person at a time... All and all, we will not stay there again. If we feel like luxury, we have to find some other place. But if we feel like a regular hotel in the heart of the city, maybe we will try Red Roof Inn or something like that. At least we'll know what we are paying for."
"(1, 1)",6,10,0,1,"To start with, this hotel had the worst customer service. They were impossible to work with on EVERYTHING! Now, the problems we had in chronological order. First, we arrive at 8 PM Sat. to check in. They did not have the room with 2 beds we had reserved available, so they offered us a room with one bed and a rollaway (free of charge). However, the room was not ready yet. Finally at 10.30! (2.5 hrs later) we were able to get our room keys. But, there was no rollaway. Another 30 mins and 3 phone calls later, we had a rollaway, but had to get the charge waived a second time. Now we go to check out on Mon. and they couldn't print us a bill or give us a total. We stop 3 hrs down the road to get gas only to find out that our bank card had been overdrawn $2,127.00! We called the bank and found out the hotel had ran our card through 3 TIMES, for $709 each, when our bill was supposed to be $450. After sitting at the gas station on the phone for 1.5hrs, the money was finally put back in our account so we could continue our trip home. I would recommend a Holiday Inn over the Intercontinental any day."
"(1, 1)",6,10,0,1,"We stayed in the Amalfi in July 2010, 4th of July weekend. I was very apprehensive about leaving my Diesel Ford Excursion with the valet at Amalfi. It has a few modifications to the engine and can be damaged if not operated correctly. I explained the procedure to the valet drivers, and felt like it was a complete waste of time. When the vehicle was returned to me the valet driver did not let it idle down and cool the turbo off as I had instructed. When I tried to start it, it wasn't happy, but did finally start. I was so relieved to get it back I just wanted to leave. Driving away I noticed that the top speed recorded on the GPS was 105mph!!! (previous top speed was 95mph, done a few days earlier driving across South Dakota). I could just picture the flying Ferrari scene in Ferris Bueller's Day Off. I couldn't imagine where in the crowded Chicago traffic they found a place to go that fast, though it wouldn't take long to make that happen (see reference to modified engine above). A little while later we stopped for lunch and I noticed a dent in the front bumper. I contacted the hotel and was referred to their claims people. No remedy. Lesson learned. Brett"
"(1, 1)",6,10,0,1,"Stayed in old tower. Room was nice and room service was very good. Room Wi-Fi was expensive as was the bottled water. For the price of the room, at least there should at least have been water. I would rate the value as sub-par. The restaurant menu was not great, food mediocre by comparison to other downtown Chicago restaurants and the service was below average especially since there were only three tables in use in the entire restaurant.. In summary, I will go to the M... or H... next time. Some of the above comments are based on a previous week resort stay on the outer banks of North Carolina and earlier this year in Northern California. P.S. If you are a fitness room user, the $16 per stay per person is a good deal at this hotel."
"(1, 1)",6,10,0,1,"What can I say... this USED to be our FAVORITE hotel in Chicago because of its location, its historic and gorgeous pool, it amazing Sunday brunch, it's relatively low price compared to comparable hotels, its exclusive benefits of the ambassador membership... All of the above has fallen disappointingly by the wayside with a resounding THUD. Let's break it down: Location: I'll concede that it's still great. Get a corner room in the Historic tower higher than the 20th floor with a view of Michigan Ave and/or the river. Its historic and gorgeous pool: Closed indefinitely! When asked when it will re-open, the hotel staff actually said, ""Maybe never."" Its amazing Sunday brunch: Zest is gone, and his been replaced by a very dark Michael Jordan restaurant that takes up much of the lobby and second entrance. (The lobby, by the way, used to be beautiful and open with lots of places to sit. Also no longer...). The food is very bad. Very. Bad. There are so many restaurants in this city. Do yourself a favor and go somewhere else to eat. Its relatively low price compared to comparable hotels: Based on my review of everything else. Go to the Drake, or the Peninsula. Completely worth the extra money... That, or downgrade to the Hilton and get what you expect and pay for... The InterContinental has fallen so low that you pay a higher price than the Hilton, but you get a worse experience! Its exclusive benefits of the ambassador membership: I canceled our membership after this disaster. Part of the membership includes early check-in (granted, when available)... but our room wasn't ready until 6pm. This is obviously after normal check-in. The staff was overwhelmed, and not effective or helpful. I tried to speak with the manager about our room, waited in long line to speak with someone, only to be told that my husband needed to be with me because the membership was in his name. In a nutshell. Go somewhere else. ps: Go to Argo tea next door instead of the Starbucks in the hotel. Way better food and coffee."
"(1, 1)",6,10,0,1,"Good location and looks like a good property but did not seem to be managed well. Front desk staff was inattentive to customers and slow. Nice large suite for a room but plumbing fixtures were in disrepair (housekeeping staff could/should have reported each day) - partially clogged shower head, dripping sink, etc. Clean and OK, but neglected - we expected more from an Intercontinental Hotel. Many hotels to choose from in this area of Chicago - can get more for the price from almost any other."
"(1, 1)",6,10,0,1,"We recently stayed at the hotel allegro in chicago illinois, while the hotel was nice please take my advice and do not stay here. I payed cash for the room and handed over my credit card for incedentals ($50.00) the next day my debit card was charged $200 clearly this had to be a mistake...i called the hotel manager who was the rudest person i have ever spoken with about the charge and was told that it was my fault i paid cash and that i could give him my bank account, routing, SS # and authorization code and he could call my bank and take care of it. Clearly i am smart enough not to give this information to anyone yet alone someone who had already taken more then should have been charged. I then called corporate to complain and let them know about the situation the only thing corporate could tell me is that they had already credited my account and that they were sorry and it was clearly my mistake. I then questioned them about the manager asking for all my information if they had already credited my account and they told me they didnt have an answer for me. So for your bank accounts sake do not stay here they are many other options in chicago"
"(1, 1)",6,10,0,1,"I usually stay at the Hotel Monaco but stayed at the Allegro because most the Monaco was booked. While the Allegro is similar to the Monaco in it's decor (less traditional and more funky interior) it is not nearly as nice. The linens are not as high quality as the Monaco and the rooms are not decorated as nice. The rooms are also smaller. The main reason I would not recommend the hotel though, is the bathroom. It has an old tiled floor, with an old sink, and old toilet. It reminds me of something you would find in a men's locker room. Although the Allegro has installed a nice mirror, it does not make up for the limited counter space and dingy apperance. Also, the layout of the bathroom is terrible. The toilet is so close to the wall that the toilet paper sits in your lap as you sit on the toilet. Also, the room is not very clean as well. The floor in my room was dirty and I found crumbs in the drawers. I would recommend staying at the Monaco, Hard Rock, or Soffitel for a hotel that is a little less traditional but still nice."
"(1, 1)",6,10,0,1,"After reading all the lukewarm reviews for this hotel, I went ahead and got an Ambassador membership just to hedge off any unpleasantness. I normally have a good experience with Intercontinental hotels, particularly the Mark Hopkins in SF. I called the hotel directly to confirm that my reservation was designated as Ambassador Club. When I arrived at the hotel, there was no separate check-in line (as advertised) and the manager on duty basically ignored me when I told him I was an ambassador club member and stuck me with a regular tiny room. I was nearly half an hour checking in the room and had to deal with the arrogant attitude of the manager on duty. They gave me a room in the ""modern"" tower, (built in the 60's) which was about 2/3 the size of a regular room at the Mark Hopkins (built in '29). I had to deal with torn sheets, cracked marble sinks, and the spare roll of toilet paper being located OUTSIDE the bathroom inside the closet - how convenient is that? The closet door, if you are not careful, may break the full length mirror attached to the bathroom door. I was not provided with a key to the minibar and I called for turndown service, which never happened. The next day, they finally got around to the fact that I was an Ambassador Club member and entitled to an upgraded room, but since I travel with a medical device which I already set up in the tiny room, I declined. To their credit, they did send some of the amenities I would otherwise be entitled to as an Ambassador Club member. I would not stay at this hotel next time I go to Chicago. There are other better places for the money including, the Omni, The James, The Fairmont, Hyatt, Sheraton, Monaco, Crowne Plaza, even the Holiday Inn and Marriotts located in the same general area."
"(1, 1)",6,10,0,1,"IMO the Amalfi doesnt come close to justifying the glowing comments on TA. This is basically a Holiday Inn. Half of the rooms overlook an alley / loading dock. The hotel is not more than 6 or 7 flors high and the garbage pick up woke me up daily at 5 am. At 530, when you are just nodding off again, they begin setting up for the complimentary breakfast. This is a continental buffet on every floor next to the elevator bank. Any room within 100 feet of the elevators will hear the noise. Reception was a bit tacky and the ""staff"" was a little rough around the edges. I didn't see a single business travellers while I was there. Valet parking was expensive (usual for Chicago) but was very slow. Just ok. Explore other options."
"(1, 1)",6,10,0,1,"This is an older hotel, and the age shows. Rooms are small, and a bit drab. Bathroom in my room was in urgent need of upgrade. Bed was comfortable, though, and the room was quiet, Hotel staff was polite, but not really interested in the guest. Even the concierge was disinterested. Check-in was irritatingly slow for the few number of people in line. Really, a hotel tjhat promises so much in its promotional material should deliver better. The hotel really didnt seem to be trying."
"(1, 1)",6,10,0,1,How about this had reservation confirmation in hand and still had to argue with the registration desk about price on reservation. She tried to charge me price on bill they slide under your door. Sorry not on my watch! Then about this room you gave me I understand this place is old but for the price you charge how about some indoor plumbing! You take a shower and the tub fills with water will not drain this is absolutely redickulas for this being a Hilton I think you should step back and take a look at how this place is operating. Registration: Fail Parking price: Fail Plumbing: Fail Thank you Hilton for for my super 8 experience in Chicago.
"(1, 1)",6,10,0,1,"What's not to like? --> Problems getting the room you actually reserved: I had to call this hotel three times and email four times in order to insure that we actually got the room we had reserved. --> Overcharging. They charge for everything here. Wireless. The Fitness Center. The Business Center. I've only run into one other hotel that ever charged for use of the fitness center. Note to the Intercontinental: If you're going to charge for something that is commonly included, you should advertise that fact. What's next? Charging for sheets on the bed? --> Very poor customer service. The staff does not communicate in full sentences, or wait to hear your answer. This is Chicago, not New York. How about a little Midwestern patience?"
"(1, 1)",6,10,0,1,"Stayed at the Amalfi hotel in Chicago this month with good expectations. And what a disappointment! Paid just under $200 for a ""deluxe king"", and what we got was a 2nd floor view of construction, a dirty, badly ""rehabbed"" bathroom, itchy sheets, no down comforter!! (just sheets and the gross old hotel blanket thing) , previously opened bottles in our mini bar, and plenty of rude, inexperienced staff members & managers (def. not a 3 or 4 star staffing!!) I do live in Chicago, and have stayed at a wide range of places. I know that for $200 in February, you can expect a great hotel. As there were many available the weekend we stayed at Amalfi, choosing it over say, the Palmer House Hilton, Hotel Sax, Sutton Place, Hotel 71, was a huge waste. Definitely keep looking and book elsewhere. Not worth the price at all, don't let their pictures fool you. Also, I wouldn't say that our experience was just a rare mishap, the hotel looks like an old Days Inn that had undergone a slight renvation, i.e., new lamps."
"(1, 1)",6,10,0,1,"I'm a frequent business traveler and often in Chicago on trips. At times, it's very difficult to even find a hotel in downtown Chicago, and this was one of those times. I recently had to pay almost $400 for one night at the Allegro. It was absolutely not worth it. The hotel was filled to capacity with conventioneers, so check-in and check-out were very slow. There were very few elevators, which were worked beyond capacity with all the guests. The morning I checked out, our elevator stopped at every single floor from the 16th floor down to the lobby, but the elevator was almost completely full when I got on at the 18th floor, so I can only imagine how long it must have taken other guests to get downstairs. The room was extremely small and cramped, even though it had obviously been renovated recently. The TV, bed, and decor were all new and were the high points of the hotel. Still, the rate was way overpriced for such a small room. The best thing about the Allegro was the room service, which was prompt. The food was good, and the prices were very reasonable for room service. From now on, if my regular hotels are booked, I'll just take a cab farther out from the city because it just isn't worth it."
"(1, 1)",6,10,0,1,"Will not stay here again. We were here pre-construction so didn't have the noise problems that others are now experiencing. But room and service quality were so poor that we will not return. Our suite was large enough, but it was dirty, dated and worn. The bed linens were stained and the bathroom did not appear to have been cleaned properly. Public hall areas had room service trays sitting for two days, disgusting. We (politely) requested housekeeping to touch up our room and pick up trays and they never showed. We had paid for the King Tut Package, which was supposed to include tickets to the exhibit. They had no record of this and didn't honor it. Of course, the exhibit was sold out, so our main reason for visiting Chicago was ruined as we weren't able to see this part of the Field museum. My (also polite) letter to Hilton and the manager was never acknowledged. Very very disappointed in this property and am now avoiding Hilton in general when possible."
"(1, 1)",6,10,0,1,"Here are my experiences: - Had three rooms reserved, when checked in we were charged 2 different rates for the rooms - screwed up initial room assignments, gave us a room that was not even cleaned yet when we checked in - Could not get us new keys to a different room without great difficulty (we had to go to the front desk because bell staff went to the wrong room to give us new keys) - In room guide says pool in on the 8th floor and signs say it is on the 7th - could not get to the pool from the 14th floor without going all the way down to the lobby and then had to go to the 7th floor and take the stairs to the 8th - When we checked in we had the front desk staff go over which credit cards were assigned to which room. - When we received our bills, the credit card assignments were still wrong. I stay at ""economy"" hotels a lot and I have not even come close to having this many problems with a hotel until this one. This hotel should do Chicago a service and just close its doors. Due to this experience, I will never stay downtown again to deal with overpriced hotels with poor service and surrounding business that are just as bad."
"(1, 1)",6,10,0,1,"After Leaving some important documents in the room, I called and asked for the lost and found department... SEVEN TIMES over the course of a week. Eventually I had enough and asked for a manager and was put on hold then disconnected. Finally , a deceivingly friendly operator PROMISED me she would have someone call me back in a few minutes, It never happened. So Avoid this place because after they rip you off once they'll keep doing it later. They cannot be trusted at their word"
"(1, 1)",6,10,0,1,"I am writing in regards to our stay April 22-24. We were celebrating our honeymoon and were disappointed with our stay. There was construction going on in the hotel and we were not notified of it prior to our stay. My husband had ordered champagne and strawberries for the room to be in there prior to our arrival...it wasn't. When he called to place the order again, it never showed up. We were so disappointed and surprised by the lack of service that we decided to forgo ordering them for a 3rd time. Our room was very small, drab and lacked the romantic setting we were looking for. We had called to request a room with a large tub, similar to the ones in the photos, prior to our arrival, noting that we didn't mind an upgrade cost. Instead, the tub was incredibly small. We have stayed at the Intercontinental in other cities before and had such high expectations for the Chicago location, especially considering we were celebrating such a happy, once-in-a-lifetime occasion. The service and amenities just didn't match up."
"(1, 1)",6,10,0,1,Used this hotel the first time I was in Chicago. For the prices and for being classified an intercontinental...I wouldn't consider it that good. The rooms were solid. The view was ok (but so is it virtually everywhere else on Michigan Ave.) The service was ok. The prices were ridiculous for everything from wifi to well everything else. We came here for a Jewish/Hindi wedding. Appetizer was fine. Main entree was a small portion of meat with forgettable everything else. Dessert was inedible. I have been to some other expensive hotels with similar ratings but they had more or just better rooms to an extent that it would be worth it. I personally preferred the Conrad. Better prices and better service.
