ngram_range,min_df,cv_folds,true_label,pred_label,text
"(1, 1)",6,10,1,0,I have to agree that the InterContinental Chicago is a nice hotel from the outside. But it is not a nice place to stay if you are planning to visit Chicago. The ambience of the hotel looks bland and they also have the same amenities as other cheaper hotels. You can get an excellent dining experience somewhere for less.
"(1, 1)",6,10,1,0,Upon entering my hotel room at The Palmer House Hilton I immediately turned my nose up at a foul odor coming from the bathroom. After placing my bags on a poorly made bed I walked into the bathroom to find the last visitor had failed to flush the toilet. I immediately called room service and asked for a new room. They apologetically told me there were no other rooms available but would send someone right up to handle the mess. After oh around a half hour of waiting a very angry maid knocked at my door. She seemed very irritated to have to deal with the mess and looked at me as if I should have been the one dealing with it. After the room was cleaned up she turned to me as if asking for a tip. I hesitated and she angrily stormed out of the room. I thought things would run smoother and tried to relax with an ipod. Yes you can use your ipod in the room however what they fail to mention is the constant white noise because the signals are so poor. And nothing could compare to the remote control heating and air. When I was able to get the buttons on the remote to work the temperature seemed to change on its own. If I wanted hot air it would slowly get colder and vise versa. After giving up on a nice television program I decided to retire to bed. Egyptian sheets? Right! All I can say is I found myself early to check out and in a new hotel within the next hour. If you value your back do not rent a room from this hotel.
"(1, 1)",6,10,1,0,"First stepping foot on the hotel propety I could tell it was a negative place, Seeing as how there was what apperd to me to be Vice Lords all aroung the property. Not that i have a personal problem or affelated with another gang, It's just the way they was acting, drinking the hotels cheepest wine, they could of been there for securaty purpouses like the hell's angels was to some concerts. Walking in the hotel i oder hit me. It smelled like a cretan type of burning wood that i have smelled, only later to find out it was the smell of rock cocine. I looked at the pool only to find there was no watter and scateborders all around the place. Me being a high class bizness man, I decided to leave."
"(1, 1)",6,10,1,0,"The Amalfi Hotel has a beautiful website and interior decorating, but that's about it. When my wife and I got here, we were given keys to a room that had not even been cleaned! The Internet access promised on the hotel's website was down, so I couldn't catch up on any of the business I had intended to do, and my wife thought that the dark design details in the room made her feel claustrophobic, like she was sleeping inside a Salvador Dali painting. All in all, this hotel was not worth the money, especially since we spent most of our time enjoying the city--something more casual and comfortable would have been better, and it would probably have been cleaner, too!"
"(1, 1)",6,10,1,0,"The International Chicago Magnificent Mile is shrouded in glamour, but underneath the facade fades away. The ""classical architectural landmark"" should be translated to ""old and boring. I found this hotel via Google and have regretted it ever since. Room size was small and unaccommodating, and that was one of the newer rooms! Everything was free except for the gym (why that wouldn't be free with the price I paid I don't know). This hotel is overpriced for the quality and size of the room that you get, and I would not recommend staying there."
"(1, 1)",6,10,1,0,"Our visit started off on the wrong foot when we entered the lobby struggling to carry all of our luggage and, instead of helping, a group of hotel employees stood watching and laughing at us. They had trouble locating our reservation. Our room was tiny! When I'm paying over $400 a night for a room, I expect to be able to walk around in it! The beds were also tiny. The walls were thin and we could hear our neighbors talking next door. This hotel was probably once beautiful and classy, but now it seems to be outdated and due for repairs. Won't be staying here again."
"(1, 1)",6,10,1,0,"The pictures on this website sure are deceiving! In real life the Palmer House Hilton is not nearly as pretty as its made out to be! The cleaning staff was still there when we arrived at our room and they made us wait outside while they were still cleaning! Now, granted it was only 15 minutes and sometimes guests can be messy but I thought that was the only weird thing I would have to put up with on that trip. It wasn't! They charged us for a mini-bar fee when we don't even drink, no one told us that we would have to pay for liquor anyway! They also did not get our wake-up calls to us on time, so we missed our tour bus and almost a whole day of our trip. We had to spend $50 extra bucks on cab fees just so we could see the city in the way we'd planned! And then it wasn't as good because the tour guide wasn't there and we got lost! My husband lost the key to our room at one point on this trip and the desk gave him a hard time about getting a new one. It was terrible! I certainly won't be staying here again!"
"(1, 1)",6,10,1,0,"The Amalfi Hotel advertises itself as a ""luxury boutique hotel"" and as such I expected my experience there to be somewhat better than average. Unfortunately, this was not the case. The room I booked was not clean; in particular the bathroom looked as if someone had done a very minimal amount of cleaning after the last guest. There was hair in the corners of the room leading me to think the floor had not been swept or cleaned. In addition, although the room was supposed to be a non-smoking room, I could still detect the odor of cigarette smoke. I will say that the staff was courteous and the hotel is very well situated in terms of the many restaurants, sites and shops all within walking distance. However, given the cost of the room and my experience with the cleanliness of the room, I would not stay at the Amalfi Hotel again."
"(1, 1)",6,10,1,0,"Since this was our first visit to the ""windy city,"" we wanted to stay somewhere that was central and unique. We read many great reviews regarding the Kimpton brand so we gave it a go. The ""go"" ended up being a ""no go."" We were sorely disappointed. When we arrived the ladies at the front desk were very nice. We have two kids with us, so we needed a crib for our 6 month baby. We were told ""no problem."" Unfortunately, it took them about 1 or 2 hours to get us the crib and we were in a lurch as to what to do next. Then, we noticed a bug (or bugs) near the fridge area. Yikes! We called downstairs to complain and to be switched to a different room (or floor!). Our request was met about 30 minutes later. By this time, we were so tired from the flight and the first impressions, we almost wanted to throw the towel in. Customer service was so lacking! We wanted to get settled and go grab a bit in the city, but had to wait around for our new room and the crib. This is not what we expected at all for this HIGH price! Will have to think hard before we book with a Kimpton hotel again."
"(1, 1)",6,10,1,0,"This hotel was not at all what I expected it would be. The website and it's pictures portray the hotel in a much better condition than it is actually in. The amenities were not what I was looking for, and the price of the hotel was not a good value for what was offered there. My AAA membership did not get me a very good discount like it does at most hotels. The staff was not very friendly or helpful when I had questions about the area, and they were not very prompt when responding to requests. I understand that there were a lot of guests staying there while I was there, but they need to have more staff on hand if they cannot provide their hotel guests with quality service. I don't think I will be staying at this hotel again anytime soon."
"(1, 1)",6,10,1,0,"I recently stayed at this hotel not to long ago. Sure, it looks nice, but it's really just a smoke screen. I went to the clerk to check in and she was VERY rude to me. I was asking about nearby attractions and she abruptly cut me off to tell me that I need to go find a phone book and ask someone else. She also encoded my key wrong, so I had to have it redone. I finaly get to my room, only to discover it was a mess. The sheets were thrown on the floor, the curtains were wide open and to top it all off, the toliet hadn't been flushed. It was horrible. I called the front desk to have a maid come and fix it up, but I was told they were on break. Whatever thoguh, I cleaned up myself. The night progresses and I awaken to the sound of someone beating on my door. Some guy said that I was in HIS room. It baffled me, but we went straight down to the lobby and got it cleared up. They had given his the wrong room. I couldn't take one more day of all the bull. I checked out early the next morning and stayed at a different hotel for the remainder of my visit to Chicago. I would NOT recommend this hotel to ANYONE."
"(1, 1)",6,10,1,0,"My husband, three year old son and I arrived at the Palmer House Hilton last Friday for a weekend stay. The hotel looked elegant online but included information that also indicated it was child friendly. At the check in the staff was cold and seemed quite annoyed by son who was merely saying hi and asking the name of the person helping us. One elevator was broken we had a long wait for other elevator. The hallway appeared a bit dirty as we made our way to our room. The room was decent. Not deluxe as their website indicated it would be but is was comfortable and the view was good. We had a long day of sight seeing and play on Saturday. As my son was tired, we elected to return to our room and have room service for dinner. There was no children's menu for room service. Only for the restaurant from which the room service came from the same kitchen, what??? We ordered an adult meal. The food arrived an hour later, cold and unappealing. But we at it because we couldn't wait another hour. Although the hotel looks lovely. The service was not very good. Most of the staff was cold and snooty. Except for the cleaning staff who were very nice. It might be ok for a couple or business traveler but do not stay with children. A comfortable motel might be better."
"(1, 1)",6,10,1,0,"My wife and I were excited to visit and shop at Chicago's Magnificent Mile on Michigan Ave. We chose the Intercontinental Hotel for it's reputation and location. Man oh man, were we disappointed. The check in was smooth enough even though the hotel was busy and all seemed well. We got ready to go out shopping and went to visit the concierge in the lobby to ask about suggestions and bargains. There were six people in line for her and we had to wait. That was no problem since we weren't on a timetable. When we finally got to her and asked about shopping on the Miracle Mile, she just pointed to the door and said, ""It's right out the door."" I asked her for suggestions of the best stores for bargains and she rolled her eyes at me saying, ""there's no such thing."" I couldn't believe her abruptness. We left the concierge stand not wanting to return. Shopping went well and was fun. We returned to our room and wanted to look up a restaurant for the night ourselves rather than ask the concierge. We couldn't find a hotel directory in the room. I called the Housekeeping Department and was told, ""we're all out of directories here in the office."" I asked if they could check a vacant room for one. She said the hotel was full and there were no vacant rooms. I hung up and thought I would just look for a restaurant in the yellow pages. Guess what? You guessed it, no phone book in the room. I figured we could go get a drink at The Bar, the hotel's 20's themed lounge, and ask the bartender for suggestions. We went to The Bar and there were only three other customers. We sat at the bar and got our drinks. As I was about to ask the bartender for restaurant suggestions, his cell phone rang. He answered it and went to the other end of the bar to talk. Twenty minutes later, he was still on the phone. Tired and hungry, my wife and I went back to our room and ordered a pizza to be delivered from Pizza Hut. Although the hotel is nice enough and the furnishings comfortable, the indifference of the staff will keep me from ever coming back. A big thumbs down to the Intercontinental Chicago. They need to look up the word hospitality in the dictionary."
"(1, 1)",6,10,1,0,"Your website wowed me enough to book online although I had never used your hotel. I had high expectations when visiting your hotel with my family on our recent trip to Chicago and I was VERY disappointed. The first problem was that there was not enough staff at the desk. We had to wait a long time to get checked in. When we finally got to the room the beds were unmade and cleaning supplies were in the bathroom. The maid hadn't finished the room and she'd left her stuff behind! Of course we called the desk right away and got a new room but it was a huge hassle. The next problem was the dog of the person across the hall and down one. We knew this was a pet friendly hotel but we envisioned well controlled, non barking pets. This animal barked repeatedly when my kids were trying to go to sleep. I called the desk twice and eventually the barking stopped. I think the dog just gave up because it didn't sound like the desk staff knew what to do. The crowning disaster, at least for my kids and husband, was that the remote control for the tv was dead. We managed to get that taken care of but it was just the icing on the cake. Your hotel looks great but actually being there is not great. I cannot recommend it to anyone."
"(1, 1)",6,10,1,0,"This hotel is ok but is not the best for the money. First of all the parking prices are exorbitant. I know parking is at a premium for this location but the price is much too high. Also, the service at this hotel was poor. I felt like room service took too long and considering the price the service was poor in general, and the staff at The Palmer House seemed more interested in helping the richer or more known customers more than us. In addition I feel that there were too many fees including a fee for internet. Also the rooms were very clean and beds very nice but there was some noise and you could hear the people walking above you. I would say it was an average experience at this hotel and considering the price maybe think twice about The Palmer House."
"(1, 1)",6,10,1,0,"I only stayed here for five days, but I will definitely never be going back. The architecture is kind of cool, but the customer service was very poor. I don't know how much these people get paid, but they must not think it is enough. Breakfast at the The Continental was alright, but it was overpriced. This hotel felt really crowded and the service was impersonal. There are many better places to stay in Chicago."
"(1, 1)",6,10,1,0,"While the hotel looked absolutely lovely from the outside, my experience went downhill once I walked in. The lighting is very poor, which creates such a dark and gloomy atmosphere. The mood was accompanied by less-than-friendly staff members who made our check-in seem like nothing more than a huge hassle. I would not recommend this hotel to anyone looking for a quiet night or a nice stay. I definitely would not stay here again."
"(1, 1)",6,10,1,0,"This hotel is dizzying with all of the bold colors and patterns everywhere. It smells because pets are allowed. This hotel is also extremely dirty because of the pets allowed. There was mold in our room and bathroom, pet hair everywhere! Kids love pools. How can they claim to be kid friendly without one? My kid was bored. The food was basically the same every day, no variation in the menu. Pictures on their website of the rooms must be reserved for their ""travel club"" because our room didn't even remotely resemble the pictures. They did the old bait and switch. We reserved a ""family room"". When we opened the door of our room, we realized that it wasn't what the website pictured or had what the website described. We kept our mouths shut for fear of retaliation by the hotel workers. Definitely do not recommend this hotel!!!"
"(1, 1)",6,10,1,0,"Recently stayed at the InterContinental Chicago Magnificent Mile and was a little underwhelmed. It's convenient location did not compensate for the fact that the property is very old and definitely in need of some updating and renovating. There is a definite need for some noise control -- everything and everybody could be heard from inside the room. Hearing the plumbing from other guests' rooms was particularly annoying. The fitness facilities are really hyped but unfortunately they were not free to use (at least it wasn't included with my booking choice). Parking was pretty expensive so if you really don't need it, don't use it. Overall, just dissappointed that the great location wasn't matched with great accommodations."
"(1, 1)",6,10,1,0,"My wife and I were very much looking forward to our stay at the Hotel Allegro in Chicago. We had been looking forward to a romantic getaway. I have to say Hotel Allegro was a disappointment for both of us. This is a pet friendly hotel - we knew that going in. But we were shocked by the fact that we found pet hair around the room we were given. In the carpet and even an amount on the bed cover. Very shocking for the price we were paying. When we called the front desk it took over an hour for someone from housekeeping to stop by. Past this - the room itself - it has flair I guess, but I can't imagine it is the right flair for many. The colorings used a bright blue on the bed and a muted yellow, designy wallpaper. Neither myself or my wife found it relaxing at all. I can't imagine many would. It really was off-putting. Overall, the experience was a check minus in my book. Will not be looking to return any time soon."
"(1, 1)",6,10,1,0,"I have been stayed in Allegro for two days. There are not other big prolems but one thing I'm not satisfied with is the light. It is dark in the room. Also in the bathroom, the light is not good. I have to open curtains. I have complained about this to their reception. They said they will fix it, but I did not get any response. I am very disappointed and I will never come back again."
"(1, 1)",6,10,1,0,"The service was only subpar and then rooms needed better cleaning. I was at the check in counter longer than expected because they decided to use a trainee to check me in, definitely no fun after such a long flight. There were no clean towels in the room and my bill was returned with room service charges of which I did not order."
"(1, 1)",6,10,1,0,I needed to find a last minute hotel to stay in for the night so i came to this one. First of all the prices for one night are extremely high. The workers at the front desk were not kind at all and treated me like i was a second rate and not on their list of priorities. Then i got into my room and got settled and it smelled of cigarettes and the air conditioner was making loud sounds so i didnt get much sleep. Also the restroom was very dirty and frankly disgusting. The beds were very old and uncomfortable and the tv did not work at all. Overall i am very disappointed with this hotel.
"(1, 1)",6,10,1,0,"I was unimpressed by the quality of this hotel. The overall look of the place was marred by what felt like poor maintenance. Given that this is supposed to be a luxury hotel and charges rates at that level, this was most disappointing. Nor was I impressed with the snooty attitude taken by the hotel staff."
"(1, 1)",6,10,1,0,"The Palmer House Hilton, while it looks good in pictures, and the outside, is actually a disaster of a hotel. When I went through, the lobby was dirty, my room hadn't been cleaned, and smelled thoroughly of smoke. When I requested more pillows, the lady on the phone scoffed at me and said she'd send them up. It took over an hour for 2 pillows. This hotel is a good example that what you pay for isn't always what you get. I will not be returning."
"(1, 1)",6,10,1,0,"When my husband and I went to Amalfi Hotel we were expecting first class service. First, when we got there we learned they had given our room to another guest and we were not able to get a suite like we had booked. Room service took forever and the food was subpar. Supposedly they had planners to help explore the area, but we requested one and never saw hide nor hair of a planner. The spa staff seemed incompetent. The only positive things I can say about Amalfi Hotel was that the rooms were stylish as advertised. I give this hotel two stars."
"(1, 1)",6,10,1,0,"Though grand and having a brand, this hotel seems to disappoint me on certain fronts. 1. Staff seemed snooty and arrogant. 2. Request for upgrade was fulfilled only after repetitive requests.The initial room was very small. 3. for the cost paid I would expect a coffee maker, free internet service at the least which even regular B&Bs offer. 4.They will levy charges on each and everything.Complete rip off Other things matched the Grandeur.Cleanliness and location was good, but the staff made my stay unpleasant."
"(1, 1)",6,10,1,0,"This hotel was very poor with customer service. They were so worried about keeping everything up to date and perfect looking in the hotel they rarely worried about their customers, and their guests. I had to ask for my room to be serviced for cleaning, and it took a long time to get a response. Very disappointed."
"(1, 1)",6,10,1,0,"My stay at The Palmer House Hilton was less than satisfactory. I would have expected much for from such a ""high end"" hotel. The rooms were way over priced, and the service was less than satisfactory. At one point, I left my dirty towels on the floor to be picked up, and when room service came through, they were still there! On the other side of things, the cup I had left on my desk (which I was planning to use later) was gone. My coffee and my towels were also never replaced. I also was astounded that internet service did not come with the price of the room. Rather, it was a ""nominal fee"". After paying so much for a room, I had hoped to at least have complimentary wifi. My stay at the Palmer House Hilton left much to be wished for. I will not be staying there again."
"(1, 1)",6,10,1,0,"A decent place to stay. The people are nice enough, yet the atmosphere was not what I was expecting. The rooms were not very spacious, nor welcoming. So many places to eat, yet the food was very pricey and average. I would stay here again possibly, but I feel like I could find a better option for a better price."
"(1, 1)",6,10,1,0,"I had an awful experience here. The staff were rude and unhelpful. It took forever to check in and when I did, they took a while to even find my reservation. When I got to the room, it was marginally clean and when I complained, they said they were full and could not do anything for me. I would never go back. They are obviously not worried about customer service."
"(1, 1)",6,10,0,1,"I booked this hotel for a business trip since I was able to get a $129 rate on Travelzoo and figured I'd save my company some money. I had also read excellent reviews on TripAdvisor. I had a guaranteed and confirmed room reservation for two nights in November. When I arrived in Chicago at 7:30pm I decided to go to dinner prior to checking in so called the hotel to request a late check in and was told ""no problem."" When I arrived at the hotel at 11:45pm I was told they didn't have a room for me and that I'd have to move to the Four Points Sheraton which they paid for. It was a major inconvenience to have to move and completely unacceptable that my confirmed room was given away. I was told that they overbooked and didn't get as many cancellations as they expected. I did check into the hotel the next day and once there did have a good experience. I would recommend staying here but do ensure that your reservation is indeed confirmed and avoid any late check-ins or you might not have a room! The ""experience designers"" were great and very helpful. The rooms were very nice and comfortable (felt like home). The breakfast could stand to add on some bagels for the ""healthy factor."" It was nice that they did have fruit. I think that once the kinks are worked out that this will be a great hotel--they just need to get the basics down!"
