ngram_range,min_df,cv_folds,true_label,pred_label,text
"(1, 1)",2,5,0,1,"Me and my husband stayed in the Allegro Hotel Chicago for 4 days 3 nights recently. We got a room with a king size bed.. Although the room is small, we got no problems with that as there was enough space for our luggages & all. However, we felt that the bed is not exactly comfortable, the bed sheets kinda feel rough to us. The walls are really thin and we could hear our neighbours talking and occasionally the flushing sound. 1 of the days, our room was not cleaned till afternoon and so we went to check with the front desk and was told that we got to request for our room to be cleaned which was a shock to us as we thought that like all hotels, rooms are cleaned except when you put on the no disturb sign. The worst is upon returning to the hotel at night, we found a bag of our garbage in the room and it was right next to our luggage. The housekeeping people must have forgotten to take it out after cleaning our bins. This is unacceptable to us. The hotel is in the theatre district and it is rather quiet at night. Although it is near the CTA trains, i would rec one to stay somewhere close to the magnificent mile where its lively at night or hotels near the chicago river so that you can get a great view. Am staying again at a Kimpton hotel in San Fran next month and i am contemplating if i should change! Overall, not a good experience and i wouldnt choose this hotel again if i were to head to Chicago again!"
"(1, 1)",2,5,0,1,"My husband and I and our 10 month old took a quick trip to Chicago. We stayed one night at The Palmer house after reading that they were a four star hotel. I guess I am just confused as to why they are a four star hotel. Yes the lounge area is nice but the rooms were so small I couldn't set up a pack and play for my son. I had to call and ""upgrade"" my room just so my son could have someplace to sleep. The lower levels have been updated which makes them slightly better than a Holiday Inn. The wall paper is peeling away from the walls and the shower was dirty. I will NEVER stay there again."
"(1, 1)",2,5,0,1,"As I sit here in my 14th floor room at the hotel Allegro, I listen to the conversation between husband and wife in the room on my left. She seems to have a cough today. In the room on my right, someone seems to use the restroom quite a bit. I hear the water running and the toilet flushing. I also hear footsteps in the room upstairs. Even roadside motels have better insulation between the rooms. I've stayed in about a dozen Kimpton hotels and this is by far the worst. The room is dirty - the carpet covered in spots and stains, the curtains with a large brown stain (I don't want to guess what it is), paint peeling, rips in the wallpaper. The decor is a bit garish, with Pepto-Bismol covered walls, green and yellow pillows and the filthy brown and white carpet. The size of the room is fine and the bed comfortable, but I'm so glad I had earplugs to avoid listening to others' toilets flushing all night. The location is good for downtown theaters or business. Only three elevators serve this 17+ storey building and they run very slowly. Chicago has many nice hotel options -- many I've enjoyed quite a bit. Unfortunately this is not one of them, and even more unfortunate for me: I'm stuck here for two more nights. I was looking forward to staying here because most Kimptons are hip, comfortable and attractive. This is not."
"(1, 1)",2,5,0,1,"We stayed in the Amalfi in July 2010, 4th of July weekend. I was very apprehensive about leaving my Diesel Ford Excursion with the valet at Amalfi. It has a few modifications to the engine and can be damaged if not operated correctly. I explained the procedure to the valet drivers, and felt like it was a complete waste of time. When the vehicle was returned to me the valet driver did not let it idle down and cool the turbo off as I had instructed. When I tried to start it, it wasn't happy, but did finally start. I was so relieved to get it back I just wanted to leave. Driving away I noticed that the top speed recorded on the GPS was 105mph!!! (previous top speed was 95mph, done a few days earlier driving across South Dakota). I could just picture the flying Ferrari scene in Ferris Bueller's Day Off. I couldn't imagine where in the crowded Chicago traffic they found a place to go that fast, though it wouldn't take long to make that happen (see reference to modified engine above). A little while later we stopped for lunch and I noticed a dent in the front bumper. I contacted the hotel and was referred to their claims people. No remedy. Lesson learned. Brett"
"(1, 1)",2,5,0,1,"Often visit Chicago, but this was my first stay at this location. Was able to secure a good rate through travelzoo. Thought the room was clean and was nicely decorated. Was very disappointed in the service. Stayed on a Saturday night - waited 20 minutes for extra pillows - called for 15 minutes but found out the third shift crew came in 20 minutes late. Also received an incorrect folio under my door(another guests that was staying at this location). I called the front dest to inform them of the error - and they explained that this was made in error and would be corrected. I opened my credit card statement and found that I was charged for three different rooms - one on the date of my visit and two a week later. I called the hotel and guest services took the information and forwarded to their accounting department. Received a message to call the billing department, have called three times - but have not received another reply back."
"(1, 1)",2,5,0,1,"Stayed in old tower. Room was nice and room service was very good. Room Wi-Fi was expensive as was the bottled water. For the price of the room, at least there should at least have been water. I would rate the value as sub-par. The restaurant menu was not great, food mediocre by comparison to other downtown Chicago restaurants and the service was below average especially since there were only three tables in use in the entire restaurant.. In summary, I will go to the M... or H... next time. Some of the above comments are based on a previous week resort stay on the outer banks of North Carolina and earlier this year in Northern California. P.S. If you are a fitness room user, the $16 per stay per person is a good deal at this hotel."
"(1, 1)",2,5,0,1,"As a frequent traveler to Chicago, I generally stay at the Sutton Court, but thought I would try a different boutique hotel. I will never stay at this hotel again. The first room they brought me to -- their standard room -- was a glorified closet, leaving me absolutely claustrophobic! Actually the smallest hotel room I've been in in the U.S! I complained to the front desk, who then moved me to a ""premium"" room -- still quite small, but manageably so. The bathroom was tiny, without a vanity, making it difficult to put your toiletries in the room. The location leaves much to be desired, as my room looked out directly onto the El (elevated subway - background noise), and the street was pretty deserted on a Sunday evening. I will say that the free wi-fi was great. If you can find a chain or other hotel closer to Michigan Avene, I'd highly recommend you take that. If you want a nice room in a great location, check out Sutton Place hotel instead."
"(1, 1)",2,5,0,1,"What can I say... this USED to be our FAVORITE hotel in Chicago because of its location, its historic and gorgeous pool, it amazing Sunday brunch, it's relatively low price compared to comparable hotels, its exclusive benefits of the ambassador membership... All of the above has fallen disappointingly by the wayside with a resounding THUD. Let's break it down: Location: I'll concede that it's still great. Get a corner room in the Historic tower higher than the 20th floor with a view of Michigan Ave and/or the river. Its historic and gorgeous pool: Closed indefinitely! When asked when it will re-open, the hotel staff actually said, ""Maybe never."" Its amazing Sunday brunch: Zest is gone, and his been replaced by a very dark Michael Jordan restaurant that takes up much of the lobby and second entrance. (The lobby, by the way, used to be beautiful and open with lots of places to sit. Also no longer...). The food is very bad. Very. Bad. There are so many restaurants in this city. Do yourself a favor and go somewhere else to eat. Its relatively low price compared to comparable hotels: Based on my review of everything else. Go to the Drake, or the Peninsula. Completely worth the extra money... That, or downgrade to the Hilton and get what you expect and pay for... The InterContinental has fallen so low that you pay a higher price than the Hilton, but you get a worse experience! Its exclusive benefits of the ambassador membership: I canceled our membership after this disaster. Part of the membership includes early check-in (granted, when available)... but our room wasn't ready until 6pm. This is obviously after normal check-in. The staff was overwhelmed, and not effective or helpful. I tried to speak with the manager about our room, waited in long line to speak with someone, only to be told that my husband needed to be with me because the membership was in his name. In a nutshell. Go somewhere else. ps: Go to Argo tea next door instead of the Starbucks in the hotel. Way better food and coffee."
"(1, 1)",2,5,0,1,"Good location and looks like a good property but did not seem to be managed well. Front desk staff was inattentive to customers and slow. Nice large suite for a room but plumbing fixtures were in disrepair (housekeeping staff could/should have reported each day) - partially clogged shower head, dripping sink, etc. Clean and OK, but neglected - we expected more from an Intercontinental Hotel. Many hotels to choose from in this area of Chicago - can get more for the price from almost any other."
"(1, 1)",2,5,0,1,"We recently stayed at the hotel allegro in chicago illinois, while the hotel was nice please take my advice and do not stay here. I payed cash for the room and handed over my credit card for incedentals ($50.00) the next day my debit card was charged $200 clearly this had to be a mistake...i called the hotel manager who was the rudest person i have ever spoken with about the charge and was told that it was my fault i paid cash and that i could give him my bank account, routing, SS # and authorization code and he could call my bank and take care of it. Clearly i am smart enough not to give this information to anyone yet alone someone who had already taken more then should have been charged. I then called corporate to complain and let them know about the situation the only thing corporate could tell me is that they had already credited my account and that they were sorry and it was clearly my mistake. I then questioned them about the manager asking for all my information if they had already credited my account and they told me they didnt have an answer for me. So for your bank accounts sake do not stay here they are many other options in chicago"
"(1, 1)",2,5,0,1,"After reading all the lukewarm reviews for this hotel, I went ahead and got an Ambassador membership just to hedge off any unpleasantness. I normally have a good experience with Intercontinental hotels, particularly the Mark Hopkins in SF. I called the hotel directly to confirm that my reservation was designated as Ambassador Club. When I arrived at the hotel, there was no separate check-in line (as advertised) and the manager on duty basically ignored me when I told him I was an ambassador club member and stuck me with a regular tiny room. I was nearly half an hour checking in the room and had to deal with the arrogant attitude of the manager on duty. They gave me a room in the ""modern"" tower, (built in the 60's) which was about 2/3 the size of a regular room at the Mark Hopkins (built in '29). I had to deal with torn sheets, cracked marble sinks, and the spare roll of toilet paper being located OUTSIDE the bathroom inside the closet - how convenient is that? The closet door, if you are not careful, may break the full length mirror attached to the bathroom door. I was not provided with a key to the minibar and I called for turndown service, which never happened. The next day, they finally got around to the fact that I was an Ambassador Club member and entitled to an upgraded room, but since I travel with a medical device which I already set up in the tiny room, I declined. To their credit, they did send some of the amenities I would otherwise be entitled to as an Ambassador Club member. I would not stay at this hotel next time I go to Chicago. There are other better places for the money including, the Omni, The James, The Fairmont, Hyatt, Sheraton, Monaco, Crowne Plaza, even the Holiday Inn and Marriotts located in the same general area."
"(1, 1)",2,5,0,1,"We booked the Amalfi looking for a great boutique hotel in Chicago. The hotel is a nice property with clean rooms and nice amenities in a good location. However, when i booked the hotel I was offered an upgraded room from a king room to a corner king room for only $10 more. That was great until I checked in. The corner room looked at two brick walls and an alley. During the night there were several homeless individuals fighting in the alley. It would seem that this is a place for them to congregate. On top of this, the dumpsters in the alley were being emptied by the waste department between 5 and 6 am in the morning. The noise was crazy loud. I think this is a nice hotel with some unfortunate aspects due to its location. The staff is extremely friendly and very helpful."
"(1, 1)",2,5,0,1,"IMO the Amalfi doesnt come close to justifying the glowing comments on TA. This is basically a Holiday Inn. Half of the rooms overlook an alley / loading dock. The hotel is not more than 6 or 7 flors high and the garbage pick up woke me up daily at 5 am. At 530, when you are just nodding off again, they begin setting up for the complimentary breakfast. This is a continental buffet on every floor next to the elevator bank. Any room within 100 feet of the elevators will hear the noise. Reception was a bit tacky and the ""staff"" was a little rough around the edges. I didn't see a single business travellers while I was there. Valet parking was expensive (usual for Chicago) but was very slow. Just ok. Explore other options."
"(1, 1)",2,5,0,1,"Reservation was for a King size bed, instead I was given a double-bed room. Check-in person must had a bad hair day, because she was unfriendly. Wall St Journal or USA Today is not complimentary. Requested a room that is away from the noisy elevator, but given a room next to a service elevator which is more noisy. I didn't bother to file a formal complain because I was very tire. I travel often to Chicago for business and the first will be the last at Intercontinental."
"(1, 1)",2,5,0,1,How about this had reservation confirmation in hand and still had to argue with the registration desk about price on reservation. She tried to charge me price on bill they slide under your door. Sorry not on my watch! Then about this room you gave me I understand this place is old but for the price you charge how about some indoor plumbing! You take a shower and the tub fills with water will not drain this is absolutely redickulas for this being a Hilton I think you should step back and take a look at how this place is operating. Registration: Fail Parking price: Fail Plumbing: Fail Thank you Hilton for for my super 8 experience in Chicago.
"(1, 1)",2,5,0,1,"What's not to like? --> Problems getting the room you actually reserved: I had to call this hotel three times and email four times in order to insure that we actually got the room we had reserved. --> Overcharging. They charge for everything here. Wireless. The Fitness Center. The Business Center. I've only run into one other hotel that ever charged for use of the fitness center. Note to the Intercontinental: If you're going to charge for something that is commonly included, you should advertise that fact. What's next? Charging for sheets on the bed? --> Very poor customer service. The staff does not communicate in full sentences, or wait to hear your answer. This is Chicago, not New York. How about a little Midwestern patience?"
"(1, 1)",2,5,0,1,"Stayed at the Amalfi hotel in Chicago this month with good expectations. And what a disappointment! Paid just under $200 for a ""deluxe king"", and what we got was a 2nd floor view of construction, a dirty, badly ""rehabbed"" bathroom, itchy sheets, no down comforter!! (just sheets and the gross old hotel blanket thing) , previously opened bottles in our mini bar, and plenty of rude, inexperienced staff members & managers (def. not a 3 or 4 star staffing!!) I do live in Chicago, and have stayed at a wide range of places. I know that for $200 in February, you can expect a great hotel. As there were many available the weekend we stayed at Amalfi, choosing it over say, the Palmer House Hilton, Hotel Sax, Sutton Place, Hotel 71, was a huge waste. Definitely keep looking and book elsewhere. Not worth the price at all, don't let their pictures fool you. Also, I wouldn't say that our experience was just a rare mishap, the hotel looks like an old Days Inn that had undergone a slight renvation, i.e., new lamps."
"(1, 1)",2,5,0,1,"I'm a frequent business traveler and often in Chicago on trips. At times, it's very difficult to even find a hotel in downtown Chicago, and this was one of those times. I recently had to pay almost $400 for one night at the Allegro. It was absolutely not worth it. The hotel was filled to capacity with conventioneers, so check-in and check-out were very slow. There were very few elevators, which were worked beyond capacity with all the guests. The morning I checked out, our elevator stopped at every single floor from the 16th floor down to the lobby, but the elevator was almost completely full when I got on at the 18th floor, so I can only imagine how long it must have taken other guests to get downstairs. The room was extremely small and cramped, even though it had obviously been renovated recently. The TV, bed, and decor were all new and were the high points of the hotel. Still, the rate was way overpriced for such a small room. The best thing about the Allegro was the room service, which was prompt. The food was good, and the prices were very reasonable for room service. From now on, if my regular hotels are booked, I'll just take a cab farther out from the city because it just isn't worth it."
"(1, 1)",2,5,0,1,"Will not stay here again. We were here pre-construction so didn't have the noise problems that others are now experiencing. But room and service quality were so poor that we will not return. Our suite was large enough, but it was dirty, dated and worn. The bed linens were stained and the bathroom did not appear to have been cleaned properly. Public hall areas had room service trays sitting for two days, disgusting. We (politely) requested housekeeping to touch up our room and pick up trays and they never showed. We had paid for the King Tut Package, which was supposed to include tickets to the exhibit. They had no record of this and didn't honor it. Of course, the exhibit was sold out, so our main reason for visiting Chicago was ruined as we weren't able to see this part of the Field museum. My (also polite) letter to Hilton and the manager was never acknowledged. Very very disappointed in this property and am now avoiding Hilton in general when possible."
"(1, 1)",2,5,0,1,"Spent three nights in Chicago at this property. First of all, I have to say that it would be hard to imagine a better location as it is perfectly situated on the Magnificent Mile close to terrific restaurants, the Art Institute and Orchestra Hall. The hotel has two sides - the historic tower and a new wing. The rooms are larger on the historic side but generally are looking a little tired. This property needs to be renovated. Some observations: The junior suite I had was laid out strangely. A small bedroom and smaller sitting room separated by a corridor off of which was the very large bathroom. The mirror over the sink was not over the sink but skewed to the right - made shaving a challenge and messy. While descending in the elevator one morning, it started shaking so violently that I could barely stand up. It stopped on the 11th floor and I was greeted by an extremely worried looking hotel employee who had a technician shut it down. (This experience was far more powerful than coffee in helping me wake up - an adrenaline rush certainly cures sleepiness!) Reports from my group were of sinks stopped up, exposed bolts in rooms, and generally things not working. Now the good news - the staff is terrific. They make you feel welcome, are personable, have their own personalities, great service in the bar and really went the extra distance to help. I wish they had a better property to work in."
"(1, 1)",2,5,0,1,"It is always interesting going to a high quality Hotel. I cannot help but think about the service and the value. Maybe I have too high expectations. Certaintly the location is great and the swimming pool is really nice and the room was generally well appointed oh and the bed was great. But, the room was not well cleaned, a little smelly truthfully and they stole a watch that I left in the room. The hotel where immediately worried about there financial situation and not the service. I noticed here others on this site have lost stuff from this hotel. I know that this is always a possibility but really did not expect it at a hotel like this. Overall, Chicago exceeded my expectations but the intercontinental did not. Stay else where."
"(1, 1)",2,5,0,1,"Here are my experiences: - Had three rooms reserved, when checked in we were charged 2 different rates for the rooms - screwed up initial room assignments, gave us a room that was not even cleaned yet when we checked in - Could not get us new keys to a different room without great difficulty (we had to go to the front desk because bell staff went to the wrong room to give us new keys) - In room guide says pool in on the 8th floor and signs say it is on the 7th - could not get to the pool from the 14th floor without going all the way down to the lobby and then had to go to the 7th floor and take the stairs to the 8th - When we checked in we had the front desk staff go over which credit cards were assigned to which room. - When we received our bills, the credit card assignments were still wrong. I stay at ""economy"" hotels a lot and I have not even come close to having this many problems with a hotel until this one. This hotel should do Chicago a service and just close its doors. Due to this experience, I will never stay downtown again to deal with overpriced hotels with poor service and surrounding business that are just as bad."
"(1, 1)",2,5,0,1,"I am writing in regards to our stay April 22-24. We were celebrating our honeymoon and were disappointed with our stay. There was construction going on in the hotel and we were not notified of it prior to our stay. My husband had ordered champagne and strawberries for the room to be in there prior to our arrival...it wasn't. When he called to place the order again, it never showed up. We were so disappointed and surprised by the lack of service that we decided to forgo ordering them for a 3rd time. Our room was very small, drab and lacked the romantic setting we were looking for. We had called to request a room with a large tub, similar to the ones in the photos, prior to our arrival, noting that we didn't mind an upgrade cost. Instead, the tub was incredibly small. We have stayed at the Intercontinental in other cities before and had such high expectations for the Chicago location, especially considering we were celebrating such a happy, once-in-a-lifetime occasion. The service and amenities just didn't match up."
"(1, 1)",2,5,0,1,Used this hotel the first time I was in Chicago. For the prices and for being classified an intercontinental...I wouldn't consider it that good. The rooms were solid. The view was ok (but so is it virtually everywhere else on Michigan Ave.) The service was ok. The prices were ridiculous for everything from wifi to well everything else. We came here for a Jewish/Hindi wedding. Appetizer was fine. Main entree was a small portion of meat with forgettable everything else. Dessert was inedible. I have been to some other expensive hotels with similar ratings but they had more or just better rooms to an extent that it would be worth it. I personally preferred the Conrad. Better prices and better service.
